user,fullname,tweet-id,timestamp,url,likes,replies,retweets,text,html
CNN,CNN,959815017922289664,2018-02-03 15:45:07,/CNN/status/959815017922289664,492,65,118,Part of Federal Reserve chair Janet Yellen's legacy may be that she was astute at the right moments and made the right choices during a delicate period for the US economy http://cnn.it/2GIR10B pic.twitter.com/mcBpYMkJry,"<p class=""TweetTextSize js-tweet-text tweet-text"" data-aria-label-part=""0"" lang=""en"">Part of Federal Reserve chair Janet Yellen's legacy may be that she was astute at the right moments and made the right choices during a delicate period for the US <strong>economy</strong> <a class=""twitter-timeline-link"" data-expanded-url=""http://cnn.it/2GIR10B"" dir=""ltr"" href=""https://t.co/MEHooXBqCP"" rel=""nofollow noopener"" target=""_blank"" title=""http://cnn.it/2GIR10B""><span class=""tco-ellipsis""></span><span class=""invisible"">http://</span><span class=""js-display-url"">cnn.it/2GIR10B</span><span class=""invisible""></span><span class=""tco-ellipsis""><span class=""invisible""> </span></span></a><a class=""twitter-timeline-link u-hidden"" data-pre-embedded=""true"" dir=""ltr"" href=""https://t.co/mcBpYMkJry"">pic.twitter.com/mcBpYMkJry</a></p>"
CNN,CNN,958633908568027136,2018-01-31 09:31:49,/CNN/status/958633908568027136,300,49,152,Europe's economy grew faster than the US last year http://cnn.it/2Ep0p8U pic.twitter.com/0nbUlfAh94,"<p class=""TweetTextSize js-tweet-text tweet-text"" data-aria-label-part=""0"" lang=""en"">Europe's <strong>economy</strong> grew faster than the US last year <a class=""twitter-timeline-link"" data-expanded-url=""http://cnn.it/2Ep0p8U"" dir=""ltr"" href=""https://t.co/vwyGDfCoF6"" rel=""nofollow noopener"" target=""_blank"" title=""http://cnn.it/2Ep0p8U""><span class=""tco-ellipsis""></span><span class=""invisible"">http://</span><span class=""js-display-url"">cnn.it/2Ep0p8U</span><span class=""invisible""></span><span class=""tco-ellipsis""><span class=""invisible""> </span></span></a><a class=""twitter-timeline-link u-hidden"" data-pre-embedded=""true"" dir=""ltr"" href=""https://t.co/0nbUlfAh94"">pic.twitter.com/0nbUlfAh94</a></p>"
CNN,CNN,958586663701229570,2018-01-31 06:24:04,/CNN/status/958586663701229570,162,28,52,UK Prime Minister Theresa May's trip to China is designed to boost ties with the world's second largest economy ahead of Britain's departure from the EU http://cnn.it/2Eszj0A ,"<p class=""TweetTextSize js-tweet-text tweet-text"" data-aria-label-part=""0"" lang=""en"">UK Prime Minister Theresa May's trip to China is designed to boost ties with the world's second largest <strong>economy</strong> ahead of Britain's departure from the EU <a class=""twitter-timeline-link u-hidden"" data-expanded-url=""http://cnn.it/2Eszj0A"" dir=""ltr"" href=""https://t.co/aVl47sboU6"" rel=""nofollow noopener"" target=""_blank"" title=""http://cnn.it/2Eszj0A""><span class=""tco-ellipsis""></span><span class=""invisible"">http://</span><span class=""js-display-url"">cnn.it/2Eszj0A</span><span class=""invisible""></span><span class=""tco-ellipsis""><span class=""invisible""> </span></span></a></p>"
CNN,CNN,958549042241458176,2018-01-31 03:54:35,/CNN/status/958549042241458176,2023,359,614,"Rep. Joe Kennedy in Democratic response to President Trump’s State of the Union address: ""We choose an economy strong enough to boast record stock prices and brave enough to admit that top CEOs making 300 times their average worker is not right."" http://cnn.it/2EskpaE  #SOTUpic.twitter.com/9RpajiUUcu","<p class=""TweetTextSize js-tweet-text tweet-text"" data-aria-label-part=""0"" lang=""en"">Rep. Joe Kennedy in Democratic response to President Trump’s State of the Union address: ""We choose an <strong>economy</strong> strong enough to boast record stock prices and brave enough to admit that top CEOs making 300 times their average worker is not right."" <a class=""twitter-timeline-link"" data-expanded-url=""http://cnn.it/2EskpaE"" dir=""ltr"" href=""https://t.co/QckpDVF3cY"" rel=""nofollow noopener"" target=""_blank"" title=""http://cnn.it/2EskpaE""><span class=""tco-ellipsis""></span><span class=""invisible"">http://</span><span class=""js-display-url"">cnn.it/2EskpaE</span><span class=""invisible""></span><span class=""tco-ellipsis""><span class=""invisible""> </span></span></a> <a class=""twitter-hashtag pretty-link js-nav"" data-query-source=""hashtag_click"" dir=""ltr"" href=""/hashtag/SOTU?src=hash""><s>#</s><b>SOTU</b></a><a class=""twitter-timeline-link u-hidden"" data-pre-embedded=""true"" dir=""ltr"" href=""https://t.co/9RpajiUUcu"">pic.twitter.com/9RpajiUUcu</a></p>"
CNN,CNN,958424845456433153,2018-01-30 19:41:04,/CNN/status/958424845456433153,129,95,46,The US economy is in very good shape right now. The question is how long that will last. http://cnn.it/2FwVp1E pic.twitter.com/LGjnMcH9Iw,"<p class=""TweetTextSize js-tweet-text tweet-text"" data-aria-label-part=""0"" lang=""en"">The US <strong>economy</strong> is in very good shape right now. The question is how long that will last. <a class=""twitter-timeline-link"" data-expanded-url=""http://cnn.it/2FwVp1E"" dir=""ltr"" href=""https://t.co/nG3KJ2a3uJ"" rel=""nofollow noopener"" target=""_blank"" title=""http://cnn.it/2FwVp1E""><span class=""tco-ellipsis""></span><span class=""invisible"">http://</span><span class=""js-display-url"">cnn.it/2FwVp1E</span><span class=""invisible""></span><span class=""tco-ellipsis""><span class=""invisible""> </span></span></a><a class=""twitter-timeline-link u-hidden"" data-pre-embedded=""true"" dir=""ltr"" href=""https://t.co/LGjnMcH9Iw"">pic.twitter.com/LGjnMcH9Iw</a></p>"
CNN,CNN,958371857434103808,2018-01-30 16:10:31,/CNN/status/958371857434103808,424,116,211,Europe's economy grew faster than the US last year http://cnn.it/2Eoblnt pic.twitter.com/sLZ7Bigvyr,"<p class=""TweetTextSize js-tweet-text tweet-text"" data-aria-label-part=""0"" lang=""en"">Europe's <strong>economy</strong> grew faster than the US last year <a class=""twitter-timeline-link"" data-expanded-url=""http://cnn.it/2Eoblnt"" dir=""ltr"" href=""https://t.co/VJeoutUrz3"" rel=""nofollow noopener"" target=""_blank"" title=""http://cnn.it/2Eoblnt""><span class=""tco-ellipsis""></span><span class=""invisible"">http://</span><span class=""js-display-url"">cnn.it/2Eoblnt</span><span class=""invisible""></span><span class=""tco-ellipsis""><span class=""invisible""> </span></span></a><a class=""twitter-timeline-link u-hidden"" data-pre-embedded=""true"" dir=""ltr"" href=""https://t.co/sLZ7Bigvyr"">pic.twitter.com/sLZ7Bigvyr</a></p>"
CNN,CNN,958274749024567296,2018-01-30 09:44:38,/CNN/status/958274749024567296,650,42,198,"In one of his first acts as President of Liberia, George Weah announced he'll cut his salary by 25% as part of an effort to confront his country's ""broken economy"" http://cnn.it/2GqPNad pic.twitter.com/yYmYDlKQlB","<p class=""TweetTextSize js-tweet-text tweet-text"" data-aria-label-part=""0"" lang=""en"">In one of his first acts as President of Liberia, George Weah announced he'll cut his salary by 25% as part of an effort to confront his country's ""broken <strong>economy</strong>"" <a class=""twitter-timeline-link"" data-expanded-url=""http://cnn.it/2GqPNad"" dir=""ltr"" href=""https://t.co/jhuOGVQMIn"" rel=""nofollow noopener"" target=""_blank"" title=""http://cnn.it/2GqPNad""><span class=""tco-ellipsis""></span><span class=""invisible"">http://</span><span class=""js-display-url"">cnn.it/2GqPNad</span><span class=""invisible""></span><span class=""tco-ellipsis""><span class=""invisible""> </span></span></a><a class=""twitter-timeline-link u-hidden"" data-pre-embedded=""true"" dir=""ltr"" href=""https://t.co/yYmYDlKQlB"">pic.twitter.com/yYmYDlKQlB</a></p>"
CNN,CNN,958203189072945152,2018-01-30 05:00:17,/CNN/status/958203189072945152,853,49,241,"In one of his first acts as President of Liberia, George Weah announced he'll cut his salary by 25% as part of an effort to confront his country's ""broken economy"" http://cnn.it/2ElYqSV pic.twitter.com/Prse9BhqYF","<p class=""TweetTextSize js-tweet-text tweet-text"" data-aria-label-part=""0"" lang=""en"">In one of his first acts as President of Liberia, George Weah announced he'll cut his salary by 25% as part of an effort to confront his country's ""broken <strong>economy</strong>"" <a class=""twitter-timeline-link"" data-expanded-url=""http://cnn.it/2ElYqSV"" dir=""ltr"" href=""https://t.co/TV8vmKaVL9"" rel=""nofollow noopener"" target=""_blank"" title=""http://cnn.it/2ElYqSV""><span class=""tco-ellipsis""></span><span class=""invisible"">http://</span><span class=""js-display-url"">cnn.it/2ElYqSV</span><span class=""invisible""></span><span class=""tco-ellipsis""><span class=""invisible""> </span></span></a><a class=""twitter-timeline-link u-hidden"" data-pre-embedded=""true"" dir=""ltr"" href=""https://t.co/Prse9BhqYF"">pic.twitter.com/Prse9BhqYF</a></p>"
CNN,CNN,957046766184161281,2018-01-27 00:25:04,/CNN/status/957046766184161281,101,103,37,Why America's economy is so healthy http://cnn.it/2BwtSuP pic.twitter.com/h3f6YXF0rv,"<p class=""TweetTextSize js-tweet-text tweet-text"" data-aria-label-part=""0"" lang=""en"">Why America's <strong>economy</strong> is so healthy <a class=""twitter-timeline-link"" data-expanded-url=""http://cnn.it/2BwtSuP"" dir=""ltr"" href=""https://t.co/ELa9wCGmjv"" rel=""nofollow noopener"" target=""_blank"" title=""http://cnn.it/2BwtSuP""><span class=""tco-ellipsis""></span><span class=""invisible"">http://</span><span class=""js-display-url"">cnn.it/2BwtSuP</span><span class=""invisible""></span><span class=""tco-ellipsis""><span class=""invisible""> </span></span></a><a class=""twitter-timeline-link u-hidden"" data-pre-embedded=""true"" dir=""ltr"" href=""https://t.co/h3f6YXF0rv"">pic.twitter.com/h3f6YXF0rv</a></p>"
CNN,CNN,956886361549746176,2018-01-26 13:47:41,/CNN/status/956886361549746176,171,60,89,"The US economy grew faster in 2017, but growth slowed at year's end, numbers released by the Commerce Department show http://cnn.it/2Gji0Q9 pic.twitter.com/WKW5a0cENh","<p class=""TweetTextSize js-tweet-text tweet-text"" data-aria-label-part=""0"" lang=""en"">The US <strong>economy</strong> grew faster in 2017, but growth slowed at year's end, numbers released by the Commerce Department show <a class=""twitter-timeline-link"" data-expanded-url=""http://cnn.it/2Gji0Q9"" dir=""ltr"" href=""https://t.co/T76ineLbZd"" rel=""nofollow noopener"" target=""_blank"" title=""http://cnn.it/2Gji0Q9""><span class=""tco-ellipsis""></span><span class=""invisible"">http://</span><span class=""js-display-url"">cnn.it/2Gji0Q9</span><span class=""invisible""></span><span class=""tco-ellipsis""><span class=""invisible""> </span></span></a><a class=""twitter-timeline-link u-hidden"" data-pre-embedded=""true"" dir=""ltr"" href=""https://t.co/WKW5a0cENh"">pic.twitter.com/WKW5a0cENh</a></p>"
CNN,CNN,955450007271944192,2018-01-22 14:40:07,/CNN/status/955450007271944192,158,136,76,The government shutdown could take a bite out of the economy -- depending on how long it lasts http://cnn.it/2G6fDjU pic.twitter.com/f5Y2t9bmsy,"<p class=""TweetTextSize js-tweet-text tweet-text"" data-aria-label-part=""0"" lang=""en"">The government shutdown could take a bite out of the <strong>economy</strong> -- depending on how long it lasts <a class=""twitter-timeline-link"" data-expanded-url=""http://cnn.it/2G6fDjU"" dir=""ltr"" href=""https://t.co/FvmCR8qmSR"" rel=""nofollow noopener"" target=""_blank"" title=""http://cnn.it/2G6fDjU""><span class=""tco-ellipsis""></span><span class=""invisible"">http://</span><span class=""js-display-url"">cnn.it/2G6fDjU</span><span class=""invisible""></span><span class=""tco-ellipsis""><span class=""invisible""> </span></span></a><a class=""twitter-timeline-link u-hidden"" data-pre-embedded=""true"" dir=""ltr"" href=""https://t.co/f5Y2t9bmsy"">pic.twitter.com/f5Y2t9bmsy</a></p>"
CNN,CNN,954038122970517504,2018-01-18 17:09:48,/CNN/status/954038122970517504,171,147,83,"In the same poll, 48% of Americans approve of how the Trump administration has handled ISIS, 44% say the economy has improved since Trump took office and 18% say it has gotten worse http://cnn.it/2FRyT4g ","<p class=""TweetTextSize js-tweet-text tweet-text"" data-aria-label-part=""0"" lang=""en"">In the same poll, 48% of Americans approve of how the Trump administration has handled ISIS, 44% say the <strong>economy</strong> has improved since Trump took office and 18% say it has gotten worse <a class=""twitter-timeline-link u-hidden"" data-expanded-url=""http://cnn.it/2FRyT4g"" dir=""ltr"" href=""https://t.co/hytUzRwzVL"" rel=""nofollow noopener"" target=""_blank"" title=""http://cnn.it/2FRyT4g""><span class=""tco-ellipsis""></span><span class=""invisible"">http://</span><span class=""js-display-url"">cnn.it/2FRyT4g</span><span class=""invisible""></span><span class=""tco-ellipsis""><span class=""invisible""> </span></span></a></p>"
CNN,CNN,953929829329534976,2018-01-18 09:59:29,/CNN/status/953929829329534976,228,286,69,"""That's all he cares about. He cares about the economy,"" said President Trump's son http://cnn.it/2BdjEiK ","<p class=""TweetTextSize js-tweet-text tweet-text"" data-aria-label-part=""0"" lang=""en"">""That's all he cares about. He cares about the <strong>economy</strong>,"" said President Trump's son <a class=""twitter-timeline-link u-hidden"" data-expanded-url=""http://cnn.it/2BdjEiK"" dir=""ltr"" href=""https://t.co/lUrE39zjzo"" rel=""nofollow noopener"" target=""_blank"" title=""http://cnn.it/2BdjEiK""><span class=""tco-ellipsis""></span><span class=""invisible"">http://</span><span class=""js-display-url"">cnn.it/2BdjEiK</span><span class=""invisible""></span><span class=""tco-ellipsis""><span class=""invisible""> </span></span></a></p>"
CNN,CNN,953896761785020416,2018-01-18 07:48:05,/CNN/status/953896761785020416,100,8,68,"China's economy grew 6.9% last year, beating analysts' earlier expectations, according to official data published Thursday http://cnn.it/2mMBbcu pic.twitter.com/GwCcp2vYX7","<p class=""TweetTextSize js-tweet-text tweet-text"" data-aria-label-part=""0"" lang=""en"">China's <strong>economy</strong> grew 6.9% last year, beating analysts' earlier expectations, according to official data published Thursday <a class=""twitter-timeline-link"" data-expanded-url=""http://cnn.it/2mMBbcu"" dir=""ltr"" href=""https://t.co/c44t7r90Yv"" rel=""nofollow noopener"" target=""_blank"" title=""http://cnn.it/2mMBbcu""><span class=""tco-ellipsis""></span><span class=""invisible"">http://</span><span class=""js-display-url"">cnn.it/2mMBbcu</span><span class=""invisible""></span><span class=""tco-ellipsis""><span class=""invisible""> </span></span></a><a class=""twitter-timeline-link u-hidden"" data-pre-embedded=""true"" dir=""ltr"" href=""https://t.co/GwCcp2vYX7"">pic.twitter.com/GwCcp2vYX7</a></p>"
CNN,CNN,1015339590754885632,2018-07-06 20:59:57,/CNN/status/1015339590754885632,140,61,61,"The US economy added 213,000 jobs in June. Unemployment ticked up to 4% — the first time in almost a year that the unemployment rate inched up. CNNMoney's @ChristineRomans reports http://cnnmon.ie/2u0JVjj pic.twitter.com/0wsXryKptT","<p class=""TweetTextSize js-tweet-text tweet-text"" data-aria-label-part=""0"" lang=""en"">The US <strong>economy</strong> added 213,000 jobs in June. Unemployment ticked up to 4% — the first time in almost a year that the unemployment rate inched up. CNNMoney's <a class=""twitter-atreply pretty-link js-nav"" data-mentioned-user-id=""16329199"" dir=""ltr"" href=""/ChristineRomans""><s>@</s><b>ChristineRomans</b></a> reports <a class=""twitter-timeline-link"" data-expanded-url=""http://cnnmon.ie/2u0JVjj"" dir=""ltr"" href=""https://t.co/kAGojOkij8"" rel=""nofollow noopener"" target=""_blank"" title=""http://cnnmon.ie/2u0JVjj""><span class=""tco-ellipsis""></span><span class=""invisible"">http://</span><span class=""js-display-url"">cnnmon.ie/2u0JVjj</span><span class=""invisible""></span><span class=""tco-ellipsis""><span class=""invisible""> </span></span></a><a class=""twitter-timeline-link u-hidden"" data-pre-embedded=""true"" dir=""ltr"" href=""https://t.co/0wsXryKptT"">pic.twitter.com/0wsXryKptT</a></p>"
CNN,CNN,1015214577850593280,2018-07-06 12:43:11,/CNN/status/1015214577850593280,234,139,99,"JUST IN: The US economy added 213,000 jobs in June and the unemployment rate ticked up to 4% as more people entered the labor force looking for work https://cnnmon.ie/2lZSw1y pic.twitter.com/w3ysWDwACD","<p class=""TweetTextSize js-tweet-text tweet-text"" data-aria-label-part=""0"" lang=""en"">JUST IN: The US <strong>economy</strong> added 213,000 jobs in June and the unemployment rate ticked up to 4% as more people entered the labor force looking for work <a class=""twitter-timeline-link"" data-expanded-url=""https://cnnmon.ie/2lZSw1y"" dir=""ltr"" href=""https://t.co/lmgi1tRLOC"" rel=""nofollow noopener"" target=""_blank"" title=""https://cnnmon.ie/2lZSw1y""><span class=""tco-ellipsis""></span><span class=""invisible"">https://</span><span class=""js-display-url"">cnnmon.ie/2lZSw1y</span><span class=""invisible""></span><span class=""tco-ellipsis""><span class=""invisible""> </span></span></a><a class=""twitter-timeline-link u-hidden"" data-pre-embedded=""true"" dir=""ltr"" href=""https://t.co/w3ysWDwACD"">pic.twitter.com/w3ysWDwACD</a></p>"
CNN,CNN,1025461569747070978,2018-08-03 19:21:05,/CNN/status/1025461569747070978,258,136,96,"The US economy added 157,000 jobs in July, and the unemployment rate fell to 3.9%. The US has added jobs every month for almost eight years. https://cnn.it/2M0NCjj pic.twitter.com/i3DfgTJ3Hm","<p class=""TweetTextSize js-tweet-text tweet-text"" data-aria-label-part=""0"" lang=""en"">The US <strong>economy</strong> added 157,000 jobs in July, and the unemployment rate fell to 3.9%. The US has added jobs every month for almost eight years. <a class=""twitter-timeline-link"" data-expanded-url=""https://cnn.it/2M0NCjj"" dir=""ltr"" href=""https://t.co/5dmC73hy2n"" rel=""nofollow noopener"" target=""_blank"" title=""https://cnn.it/2M0NCjj""><span class=""tco-ellipsis""></span><span class=""invisible"">https://</span><span class=""js-display-url"">cnn.it/2M0NCjj</span><span class=""invisible""></span><span class=""tco-ellipsis""><span class=""invisible""> </span></span></a><a class=""twitter-timeline-link u-hidden"" data-pre-embedded=""true"" dir=""ltr"" href=""https://t.co/i3DfgTJ3Hm"">pic.twitter.com/i3DfgTJ3Hm</a></p>"
CNN,CNN,1025398410575314944,2018-08-03 15:10:06,/CNN/status/1025398410575314944,115,29,38,Technology helped America's economy way more than we thought https://cnn.it/2KtHcnY pic.twitter.com/4qHXPlLYOG,"<p class=""TweetTextSize js-tweet-text tweet-text"" data-aria-label-part=""0"" lang=""en"">Technology helped America's <strong>economy</strong> way more than we thought <a class=""twitter-timeline-link"" data-expanded-url=""https://cnn.it/2KtHcnY"" dir=""ltr"" href=""https://t.co/Y1C90yqaZx"" rel=""nofollow noopener"" target=""_blank"" title=""https://cnn.it/2KtHcnY""><span class=""tco-ellipsis""></span><span class=""invisible"">https://</span><span class=""js-display-url"">cnn.it/2KtHcnY</span><span class=""invisible""></span><span class=""tco-ellipsis""><span class=""invisible""> </span></span></a><a class=""twitter-timeline-link u-hidden"" data-pre-embedded=""true"" dir=""ltr"" href=""https://t.co/4qHXPlLYOG"">pic.twitter.com/4qHXPlLYOG</a></p>"
CNN,CNN,1025372704579305472,2018-08-03 13:27:57,/CNN/status/1025372704579305472,274,195,111,"The unemployment rate fell to 3.9% and the economy added 157,000 jobs in July, the Labor Department says https://cnnmon.ie/2KoqaaU pic.twitter.com/al9v64npfB","<p class=""TweetTextSize js-tweet-text tweet-text"" data-aria-label-part=""0"" lang=""en"">The unemployment rate fell to 3.9% and the <strong>economy</strong> added 157,000 jobs in July, the Labor Department says <a class=""twitter-timeline-link"" data-expanded-url=""https://cnnmon.ie/2KoqaaU"" dir=""ltr"" href=""https://t.co/Q8eqGgJ1dA"" rel=""nofollow noopener"" target=""_blank"" title=""https://cnnmon.ie/2KoqaaU""><span class=""tco-ellipsis""></span><span class=""invisible"">https://</span><span class=""js-display-url"">cnnmon.ie/2KoqaaU</span><span class=""invisible""></span><span class=""tco-ellipsis""><span class=""invisible""> </span></span></a><a class=""twitter-timeline-link u-hidden"" data-pre-embedded=""true"" dir=""ltr"" href=""https://t.co/al9v64npfB"">pic.twitter.com/al9v64npfB</a></p>"
CNN,CNN,1025162092205301762,2018-08-02 23:31:04,/CNN/status/1025162092205301762,93,51,47,"For auto industry, weaker fuel economy rules would mean a world of chaos https://cnn.it/2LXEAUc pic.twitter.com/tGNGmLB690","<p class=""TweetTextSize js-tweet-text tweet-text"" data-aria-label-part=""0"" lang=""en"">For auto industry, weaker fuel <strong>economy</strong> rules would mean a world of chaos <a class=""twitter-timeline-link"" data-expanded-url=""https://cnn.it/2LXEAUc"" dir=""ltr"" href=""https://t.co/QxqHy1hdZY"" rel=""nofollow noopener"" target=""_blank"" title=""https://cnn.it/2LXEAUc""><span class=""tco-ellipsis""></span><span class=""invisible"">https://</span><span class=""js-display-url"">cnn.it/2LXEAUc</span><span class=""invisible""></span><span class=""tco-ellipsis""><span class=""invisible""> </span></span></a><a class=""twitter-timeline-link u-hidden"" data-pre-embedded=""true"" dir=""ltr"" href=""https://t.co/tGNGmLB690"">pic.twitter.com/tGNGmLB690</a></p>"
CNN,CNN,1035291320598781952,2018-08-30 22:21:00,/CNN/status/1035291320598781952,331,42,102,"Canada’s economy is growing faster than expected, driven by increased exports. Prime Minister Justin Trudeau remains adamant the country will only agree to a new trade deal with the US and Mexico if it’s mutually beneficial. https://cnn.it/2N1tRsl pic.twitter.com/EYgeEw4XPw","<p class=""TweetTextSize js-tweet-text tweet-text"" data-aria-label-part=""0"" lang=""en"">Canada’s <strong>economy</strong> is growing faster than expected, driven by increased exports. Prime Minister Justin Trudeau remains adamant the country will only agree to a new trade deal with the US and Mexico if it’s mutually beneficial. <a class=""twitter-timeline-link"" data-expanded-url=""https://cnn.it/2N1tRsl"" dir=""ltr"" href=""https://t.co/aP0CS6lN1P"" rel=""nofollow noopener"" target=""_blank"" title=""https://cnn.it/2N1tRsl""><span class=""tco-ellipsis""></span><span class=""invisible"">https://</span><span class=""js-display-url"">cnn.it/2N1tRsl</span><span class=""invisible""></span><span class=""tco-ellipsis""><span class=""invisible""> </span></span></a><a class=""twitter-timeline-link u-hidden"" data-pre-embedded=""true"" dir=""ltr"" href=""https://t.co/EYgeEw4XPw"">pic.twitter.com/EYgeEw4XPw</a></p>"
CNN,CNN,1034252124069060608,2018-08-28 01:31:36,/CNN/status/1034252124069060608,96,21,32,“You cross the bridge when you have to cross the bridge.” Mexican Economy Secretary Ildefonso Guajardo Villarreal responds to questions about whether his country will sign a new trade deal with the US without Canada. https://cnnmon.ie/2Nm6OW1 pic.twitter.com/nxCmTyzghJ,"<p class=""TweetTextSize js-tweet-text tweet-text"" data-aria-label-part=""0"" lang=""en"">“You cross the bridge when you have to cross the bridge.” Mexican <strong>Economy</strong> Secretary Ildefonso Guajardo Villarreal responds to questions about whether his country will sign a new trade deal with the US without Canada. <a class=""twitter-timeline-link"" data-expanded-url=""https://cnnmon.ie/2Nm6OW1"" dir=""ltr"" href=""https://t.co/D3CzTzI2Zl"" rel=""nofollow noopener"" target=""_blank"" title=""https://cnnmon.ie/2Nm6OW1""><span class=""tco-ellipsis""></span><span class=""invisible"">https://</span><span class=""js-display-url"">cnnmon.ie/2Nm6OW1</span><span class=""invisible""></span><span class=""tco-ellipsis""><span class=""invisible""> </span></span></a><a class=""twitter-timeline-link u-hidden"" data-pre-embedded=""true"" dir=""ltr"" href=""https://t.co/nxCmTyzghJ"">pic.twitter.com/nxCmTyzghJ</a></p>"
CNN,CNN,1032988418488381443,2018-08-24 13:50:05,/CNN/status/1032988418488381443,540,153,256,"Dozens of CEOs of America's biggest companies, including Apple, JPMorgan and Pepsi, are warning the Trump administration that changes in immigration policy could harm the economy and ""disrupt company operations."" https://cnn.it/2wmK6G3 ","<p class=""TweetTextSize js-tweet-text tweet-text"" data-aria-label-part=""0"" lang=""en"">Dozens of CEOs of America's biggest companies, including Apple, JPMorgan and Pepsi, are warning the Trump administration that changes in immigration policy could harm the <strong>economy</strong> and ""disrupt company operations."" <a class=""twitter-timeline-link u-hidden"" data-expanded-url=""https://cnn.it/2wmK6G3"" dir=""ltr"" href=""https://t.co/gX3Rrh5fth"" rel=""nofollow noopener"" target=""_blank"" title=""https://cnn.it/2wmK6G3""><span class=""tco-ellipsis""></span><span class=""invisible"">https://</span><span class=""js-display-url"">cnn.it/2wmK6G3</span><span class=""invisible""></span><span class=""tco-ellipsis""><span class=""invisible""> </span></span></a></p>"
