user,fullname,tweet-id,timestamp,url,likes,replies,retweets,text,html
CNN,CNN,1032965774598709253,2018-08-24 12:20:06,/CNN/status/1032965774598709253,618,157,311,"Dozens of CEOs of America's biggest companies, including Apple, JPMorgan and Pepsi, are warning the Trump administration that changes in immigration policy could harm the economy and ""disrupt company operations."" https://cnn.it/2wo4jvm ","<p class=""TweetTextSize js-tweet-text tweet-text"" data-aria-label-part=""0"" lang=""en"">Dozens of CEOs of America's biggest companies, including Apple, JPMorgan and Pepsi, are warning the Trump administration that changes in immigration policy could harm the <strong>economy</strong> and ""disrupt company operations."" <a class=""twitter-timeline-link"" data-expanded-url=""https://cnn.it/2wo4jvm"" dir=""ltr"" href=""https://t.co/kJYvQgV2je"" rel=""nofollow noopener"" target=""_blank"" title=""https://cnn.it/2wo4jvm""><span class=""tco-ellipsis""></span><span class=""invisible"">https://</span><span class=""js-display-url"">cnn.it/2wo4jvm</span><span class=""invisible""></span><span class=""tco-ellipsis""><span class=""invisible""> </span></span></a></p>"
CNN,CNN,1032841944697892865,2018-08-24 04:08:03,/CNN/status/1032841944697892865,457,640,106,"President Trump questions how he could be impeached when he's made strides improving the economy: ""I don't know how you can impeach somebody who has done a great job"" https://cnn.it/2wnQRaz pic.twitter.com/PLW3BL3k39","<p class=""TweetTextSize js-tweet-text tweet-text"" data-aria-label-part=""0"" lang=""en"">President Trump questions how he could be impeached when he's made strides improving the <strong>economy</strong>: ""I don't know how you can impeach somebody who has done a great job"" <a class=""twitter-timeline-link"" data-expanded-url=""https://cnn.it/2wnQRaz"" dir=""ltr"" href=""https://t.co/dA9VLk7hSG"" rel=""nofollow noopener"" target=""_blank"" title=""https://cnn.it/2wnQRaz""><span class=""tco-ellipsis""></span><span class=""invisible"">https://</span><span class=""js-display-url"">cnn.it/2wnQRaz</span><span class=""invisible""></span><span class=""tco-ellipsis""><span class=""invisible""> </span></span></a><a class=""twitter-timeline-link u-hidden"" data-pre-embedded=""true"" dir=""ltr"" href=""https://t.co/PLW3BL3k39"">pic.twitter.com/PLW3BL3k39</a></p>"
CNN,CNN,1032665381725503493,2018-08-23 16:26:27,/CNN/status/1032665381725503493,86,8,30,Gig economy workers need benefits. These companies are popping up to help: https://cnn.it/2wjU9f6 pic.twitter.com/siQzDIqRzd,"<p class=""TweetTextSize js-tweet-text tweet-text"" data-aria-label-part=""0"" lang=""en"">Gig <strong>economy</strong> workers need benefits. These companies are popping up to help: <a class=""twitter-timeline-link"" data-expanded-url=""https://cnn.it/2wjU9f6"" dir=""ltr"" href=""https://t.co/fJFKtWemtz"" rel=""nofollow noopener"" target=""_blank"" title=""https://cnn.it/2wjU9f6""><span class=""tco-ellipsis""></span><span class=""invisible"">https://</span><span class=""js-display-url"">cnn.it/2wjU9f6</span><span class=""invisible""></span><span class=""tco-ellipsis""><span class=""invisible""> </span></span></a><a class=""twitter-timeline-link u-hidden"" data-pre-embedded=""true"" dir=""ltr"" href=""https://t.co/siQzDIqRzd"">pic.twitter.com/siQzDIqRzd</a></p>"
CNN,CNN,1032641629570695168,2018-08-23 14:52:04,/CNN/status/1032641629570695168,476,1036,166,"President Trump questions how he could be impeached when he's made strides improving the economy: ""I don't know how you can impeach somebody who has done a great job"" https://cnn.it/2PyI5PZ pic.twitter.com/DeojALHTqV","<p class=""TweetTextSize js-tweet-text tweet-text"" data-aria-label-part=""0"" lang=""en"">President Trump questions how he could be impeached when he's made strides improving the <strong>economy</strong>: ""I don't know how you can impeach somebody who has done a great job"" <a class=""twitter-timeline-link"" data-expanded-url=""https://cnn.it/2PyI5PZ"" dir=""ltr"" href=""https://t.co/UzEeAGfrRv"" rel=""nofollow noopener"" target=""_blank"" title=""https://cnn.it/2PyI5PZ""><span class=""tco-ellipsis""></span><span class=""invisible"">https://</span><span class=""js-display-url"">cnn.it/2PyI5PZ</span><span class=""invisible""></span><span class=""tco-ellipsis""><span class=""invisible""> </span></span></a><a class=""twitter-timeline-link u-hidden"" data-pre-embedded=""true"" dir=""ltr"" href=""https://t.co/DeojALHTqV"">pic.twitter.com/DeojALHTqV</a></p>"
CNN,CNN,1032604801006223360,2018-08-23 12:25:44,/CNN/status/1032604801006223360,106,7,37,Gig economy workers need benefits. These companies are popping up to help: https://cnn.it/2wkS7eQ pic.twitter.com/XFZgTQi2zc,"<p class=""TweetTextSize js-tweet-text tweet-text"" data-aria-label-part=""0"" lang=""en"">Gig <strong>economy</strong> workers need benefits. These companies are popping up to help: <a class=""twitter-timeline-link"" data-expanded-url=""https://cnn.it/2wkS7eQ"" dir=""ltr"" href=""https://t.co/skzAWZseuV"" rel=""nofollow noopener"" target=""_blank"" title=""https://cnn.it/2wkS7eQ""><span class=""tco-ellipsis""></span><span class=""invisible"">https://</span><span class=""js-display-url"">cnn.it/2wkS7eQ</span><span class=""invisible""></span><span class=""tco-ellipsis""><span class=""invisible""> </span></span></a><a class=""twitter-timeline-link u-hidden"" data-pre-embedded=""true"" dir=""ltr"" href=""https://t.co/XFZgTQi2zc"">pic.twitter.com/XFZgTQi2zc</a></p>"
CNN,CNN,1032590808074121216,2018-08-23 11:30:07,/CNN/status/1032590808074121216,637,1268,236,"President Trump questions how he could be impeached when he's made strides improving the economy: ""I don't know how you can impeach somebody who has done a great job"" https://cnn.it/2wkcGIa pic.twitter.com/86c7MwCBJ7","<p class=""TweetTextSize js-tweet-text tweet-text"" data-aria-label-part=""0"" lang=""en"">President Trump questions how he could be impeached when he's made strides improving the <strong>economy</strong>: ""I don't know how you can impeach somebody who has done a great job"" <a class=""twitter-timeline-link"" data-expanded-url=""https://cnn.it/2wkcGIa"" dir=""ltr"" href=""https://t.co/ALrsn0OicW"" rel=""nofollow noopener"" target=""_blank"" title=""https://cnn.it/2wkcGIa""><span class=""tco-ellipsis""></span><span class=""invisible"">https://</span><span class=""js-display-url"">cnn.it/2wkcGIa</span><span class=""invisible""></span><span class=""tco-ellipsis""><span class=""invisible""> </span></span></a><a class=""twitter-timeline-link u-hidden"" data-pre-embedded=""true"" dir=""ltr"" href=""https://t.co/86c7MwCBJ7"">pic.twitter.com/86c7MwCBJ7</a></p>"
CNN,CNN,1032511755434389504,2018-08-23 06:16:00,/CNN/status/1032511755434389504,108,18,43,"“For years, our biggest export has been people.”

Ed Evans, a delegate in the West Virginia State House, talks about McDowell County's reliance on coal and what one job leaving could mean for the local economy https://cnnmon.ie/2Lhoqkn pic.twitter.com/0lWg6tWZTS","<p class=""TweetTextSize js-tweet-text tweet-text"" data-aria-label-part=""0"" lang=""en"">“For years, our biggest export has been people.”

Ed Evans, a delegate in the West Virginia State House, talks about McDowell County's reliance on coal and what one job leaving could mean for the local <strong>economy</strong> <a class=""twitter-timeline-link"" data-expanded-url=""https://cnnmon.ie/2Lhoqkn"" dir=""ltr"" href=""https://t.co/wgfde3Kb4b"" rel=""nofollow noopener"" target=""_blank"" title=""https://cnnmon.ie/2Lhoqkn""><span class=""tco-ellipsis""></span><span class=""invisible"">https://</span><span class=""js-display-url"">cnnmon.ie/2Lhoqkn</span><span class=""invisible""></span><span class=""tco-ellipsis""><span class=""invisible""> </span></span></a><a class=""twitter-timeline-link u-hidden"" data-pre-embedded=""true"" dir=""ltr"" href=""https://t.co/0lWg6tWZTS"">pic.twitter.com/0lWg6tWZTS</a></p>"
CNN,CNN,1032351642195124225,2018-08-22 19:39:46,/CNN/status/1032351642195124225,100,36,30,"“For years, our biggest export has been people.”

Ed Evans, a delegate in the West Virginia State House, talks about McDowell County's reliance on coal and what one job leaving could mean for the local economy https://cnnmon.ie/2Lhoqkn pic.twitter.com/S1JIxQ4DsT","<p class=""TweetTextSize js-tweet-text tweet-text"" data-aria-label-part=""0"" lang=""en"">“For years, our biggest export has been people.”

Ed Evans, a delegate in the West Virginia State House, talks about McDowell County's reliance on coal and what one job leaving could mean for the local <strong>economy</strong> <a class=""twitter-timeline-link"" data-expanded-url=""https://cnnmon.ie/2Lhoqkn"" dir=""ltr"" href=""https://t.co/wgfde3Kb4b"" rel=""nofollow noopener"" target=""_blank"" title=""https://cnnmon.ie/2Lhoqkn""><span class=""tco-ellipsis""></span><span class=""invisible"">https://</span><span class=""js-display-url"">cnnmon.ie/2Lhoqkn</span><span class=""invisible""></span><span class=""tco-ellipsis""><span class=""invisible""> </span></span></a><a class=""twitter-timeline-link u-hidden"" data-pre-embedded=""true"" dir=""ltr"" href=""https://t.co/S1JIxQ4DsT"">pic.twitter.com/S1JIxQ4DsT</a></p>"
CNN,CNN,1031656887836712960,2018-08-20 21:39:03,/CNN/status/1031656887836712960,168,76,77,Venezuela issues new currency in attempt to boost its wobbling economy https://cnn.it/2BtT5er pic.twitter.com/7W52lcEmFD,"<p class=""TweetTextSize js-tweet-text tweet-text"" data-aria-label-part=""0"" lang=""en"">Venezuela issues new currency in attempt to boost its wobbling <strong>economy</strong> <a class=""twitter-timeline-link"" data-expanded-url=""https://cnn.it/2BtT5er"" dir=""ltr"" href=""https://t.co/fRMWGpUsbh"" rel=""nofollow noopener"" target=""_blank"" title=""https://cnn.it/2BtT5er""><span class=""tco-ellipsis""></span><span class=""invisible"">https://</span><span class=""js-display-url"">cnn.it/2BtT5er</span><span class=""invisible""></span><span class=""tco-ellipsis""><span class=""invisible""> </span></span></a><a class=""twitter-timeline-link u-hidden"" data-pre-embedded=""true"" dir=""ltr"" href=""https://t.co/7W52lcEmFD"">pic.twitter.com/7W52lcEmFD</a></p>"
CNN,CNN,1030329400112414720,2018-08-17 05:44:06,/CNN/status/1030329400112414720,312,593,128,"Iranians vent anger at Trump as the wheels come off their economy: ""The price of an egg has doubled, and milk is about 40% more expensive"" https://cnn.it/2PhDZM7 ","<p class=""TweetTextSize js-tweet-text tweet-text"" data-aria-label-part=""0"" lang=""en"">Iranians vent anger at Trump as the wheels come off their <strong>economy</strong>: ""The price of an egg has doubled, and milk is about 40% more expensive"" <a class=""twitter-timeline-link u-hidden"" data-expanded-url=""https://cnn.it/2PhDZM7"" dir=""ltr"" href=""https://t.co/RGPBLdHW98"" rel=""nofollow noopener"" target=""_blank"" title=""https://cnn.it/2PhDZM7""><span class=""tco-ellipsis""></span><span class=""invisible"">https://</span><span class=""js-display-url"">cnn.it/2PhDZM7</span><span class=""invisible""></span><span class=""tco-ellipsis""><span class=""invisible""> </span></span></a></p>"
CNN,CNN,1030093350521712640,2018-08-16 14:06:07,/CNN/status/1030093350521712640,220,389,99,"Iranians vent anger at Trump as the wheels come off their economy: ""The price of an egg has doubled, and milk is about 40% more expensive"" https://cnn.it/2BdTgur ","<p class=""TweetTextSize js-tweet-text tweet-text"" data-aria-label-part=""0"" lang=""en"">Iranians vent anger at Trump as the wheels come off their <strong>economy</strong>: ""The price of an egg has doubled, and milk is about 40% more expensive"" <a class=""twitter-timeline-link"" data-expanded-url=""https://cnn.it/2BdTgur"" dir=""ltr"" href=""https://t.co/bG2MNptjTJ"" rel=""nofollow noopener"" target=""_blank"" title=""https://cnn.it/2BdTgur""><span class=""tco-ellipsis""></span><span class=""invisible"">https://</span><span class=""js-display-url"">cnn.it/2BdTgur</span><span class=""invisible""></span><span class=""tco-ellipsis""><span class=""invisible""> </span></span></a></p>"
CNN,CNN,1022909521545637888,2018-07-27 18:20:09,/CNN/status/1022909521545637888,225,125,69,The US economy grew at an annual rate of 4.1% for the second quarter of this year — the fastest pace in almost four years https://cnn.it/2Or1nq2 pic.twitter.com/H5UEh1HFWJ,"<p class=""TweetTextSize js-tweet-text tweet-text"" data-aria-label-part=""0"" lang=""en"">The US <strong>economy</strong> grew at an annual rate of 4.1% for the second quarter of this year — the fastest pace in almost four years <a class=""twitter-timeline-link"" data-expanded-url=""https://cnn.it/2Or1nq2"" dir=""ltr"" href=""https://t.co/QZV6IvZC7y"" rel=""nofollow noopener"" target=""_blank"" title=""https://cnn.it/2Or1nq2""><span class=""tco-ellipsis""></span><span class=""invisible"">https://</span><span class=""js-display-url"">cnn.it/2Or1nq2</span><span class=""invisible""></span><span class=""tco-ellipsis""><span class=""invisible""> </span></span></a><a class=""twitter-timeline-link u-hidden"" data-pre-embedded=""true"" dir=""ltr"" href=""https://t.co/H5UEh1HFWJ"">pic.twitter.com/H5UEh1HFWJ</a></p>"
CNN,CNN,1022840100986728453,2018-07-27 13:44:18,/CNN/status/1022840100986728453,176,329,54,"President Trump is speaking about the economy from the White House South Lawn.

Watch on CNN: http://CNN.it/go  
Live updates: https://cnn.it/2OkAoMw pic.twitter.com/OC6f66P3lv","<p class=""TweetTextSize js-tweet-text tweet-text"" data-aria-label-part=""0"" lang=""en"">President Trump is speaking about the <strong>economy</strong> from the White House South Lawn.

Watch on CNN: <a class=""twitter-timeline-link"" data-expanded-url=""http://CNN.it/go"" dir=""ltr"" href=""https://t.co/UYpqI3w42L"" rel=""nofollow noopener"" target=""_blank"" title=""http://CNN.it/go""><span class=""tco-ellipsis""></span><span class=""invisible"">http://</span><span class=""js-display-url"">CNN.it/go</span><span class=""invisible""></span><span class=""tco-ellipsis""><span class=""invisible""> </span></span></a> 
Live updates: <a class=""twitter-timeline-link"" data-expanded-url=""https://cnn.it/2OkAoMw"" dir=""ltr"" href=""https://t.co/PiSFgTNfpJ"" rel=""nofollow noopener"" target=""_blank"" title=""https://cnn.it/2OkAoMw""><span class=""tco-ellipsis""></span><span class=""invisible"">https://</span><span class=""js-display-url"">cnn.it/2OkAoMw</span><span class=""invisible""></span><span class=""tco-ellipsis""><span class=""invisible""> </span></span></a><a class=""twitter-timeline-link u-hidden"" data-pre-embedded=""true"" dir=""ltr"" href=""https://t.co/OC6f66P3lv"">pic.twitter.com/OC6f66P3lv</a></p>"
CNN,CNN,1022826801049948161,2018-07-27 12:51:27,/CNN/status/1022826801049948161,189,138,70,"The US economy roared into high gear in the spring, growing at the fastest pace in almost four years. @ChristineRomans explains: https://cnnmon.ie/2NOpm1a pic.twitter.com/827GXIp6PV","<p class=""TweetTextSize js-tweet-text tweet-text"" data-aria-label-part=""0"" lang=""en"">The US <strong>economy</strong> roared into high gear in the spring, growing at the fastest pace in almost four years. <a class=""twitter-atreply pretty-link js-nav"" data-mentioned-user-id=""16329199"" dir=""ltr"" href=""/ChristineRomans""><s>@</s><b>ChristineRomans</b></a> explains: <a class=""twitter-timeline-link"" data-expanded-url=""https://cnnmon.ie/2NOpm1a"" dir=""ltr"" href=""https://t.co/g7OxatAcjI"" rel=""nofollow noopener"" target=""_blank"" title=""https://cnnmon.ie/2NOpm1a""><span class=""tco-ellipsis""></span><span class=""invisible"">https://</span><span class=""js-display-url"">cnnmon.ie/2NOpm1a</span><span class=""invisible""></span><span class=""tco-ellipsis""><span class=""invisible""> </span></span></a><a class=""twitter-timeline-link u-hidden"" data-pre-embedded=""true"" dir=""ltr"" href=""https://t.co/827GXIp6PV"">pic.twitter.com/827GXIp6PV</a></p>"
CNN,CNN,1022823281395687424,2018-07-27 12:37:28,/CNN/status/1022823281395687424,799,432,244,JUST IN: The US economy grew at an annual rate of 4.1% for the second quarter of this year — the fastest pace in almost four years https://cnn.it/2Oi8SPQ pic.twitter.com/OwU0hRvlB6,"<p class=""TweetTextSize js-tweet-text tweet-text"" data-aria-label-part=""0"" lang=""en"">JUST IN: The US <strong>economy</strong> grew at an annual rate of 4.1% for the second quarter of this year — the fastest pace in almost four years <a class=""twitter-timeline-link"" data-expanded-url=""https://cnn.it/2Oi8SPQ"" dir=""ltr"" href=""https://t.co/yxonrHQFFA"" rel=""nofollow noopener"" target=""_blank"" title=""https://cnn.it/2Oi8SPQ""><span class=""tco-ellipsis""></span><span class=""invisible"">https://</span><span class=""js-display-url"">cnn.it/2Oi8SPQ</span><span class=""invisible""></span><span class=""tco-ellipsis""><span class=""invisible""> </span></span></a><a class=""twitter-timeline-link u-hidden"" data-pre-embedded=""true"" dir=""ltr"" href=""https://t.co/OwU0hRvlB6"">pic.twitter.com/OwU0hRvlB6</a></p>"
CNN,CNN,1022806334612406272,2018-07-27 11:30:07,/CNN/status/1022806334612406272,602,439,239,Trump's right: The economy is doing well and he deserves some credit | Analysis by @StCollinson https://cnn.it/2LGMBg8 pic.twitter.com/9i8gOzZNti,"<p class=""TweetTextSize js-tweet-text tweet-text"" data-aria-label-part=""0"" lang=""en"">Trump's right: The <strong>economy</strong> is doing well and he deserves some credit | Analysis by <a class=""twitter-atreply pretty-link js-nav"" data-mentioned-user-id=""17897395"" dir=""ltr"" href=""/StCollinson""><s>@</s><b>StCollinson</b></a> <a class=""twitter-timeline-link"" data-expanded-url=""https://cnn.it/2LGMBg8"" dir=""ltr"" href=""https://t.co/rNzrPTi6Px"" rel=""nofollow noopener"" target=""_blank"" title=""https://cnn.it/2LGMBg8""><span class=""tco-ellipsis""></span><span class=""invisible"">https://</span><span class=""js-display-url"">cnn.it/2LGMBg8</span><span class=""invisible""></span><span class=""tco-ellipsis""><span class=""invisible""> </span></span></a><a class=""twitter-timeline-link u-hidden"" data-pre-embedded=""true"" dir=""ltr"" href=""https://t.co/9i8gOzZNti"">pic.twitter.com/9i8gOzZNti</a></p>"
CNN,CNN,1022728440989003779,2018-07-27 06:20:36,/CNN/status/1022728440989003779,171,162,48,President Donald Trump thinks he's overdue some credit for steering the strongest economy on the planet -- and he's probably right | Analysis by @StCollinson https://cnn.it/2AhCHgA pic.twitter.com/X7sNUGuxiG,"<p class=""TweetTextSize js-tweet-text tweet-text"" data-aria-label-part=""0"" lang=""en"">President Donald Trump thinks he's overdue some credit for steering the strongest <strong>economy</strong> on the planet -- and he's probably right | Analysis by <a class=""twitter-atreply pretty-link js-nav"" data-mentioned-user-id=""17897395"" dir=""ltr"" href=""/StCollinson""><s>@</s><b>StCollinson</b></a> <a class=""twitter-timeline-link"" data-expanded-url=""https://cnn.it/2AhCHgA"" dir=""ltr"" href=""https://t.co/6pa7gyAo6a"" rel=""nofollow noopener"" target=""_blank"" title=""https://cnn.it/2AhCHgA""><span class=""tco-ellipsis""></span><span class=""invisible"">https://</span><span class=""js-display-url"">cnn.it/2AhCHgA</span><span class=""invisible""></span><span class=""tco-ellipsis""><span class=""invisible""> </span></span></a><a class=""twitter-timeline-link u-hidden"" data-pre-embedded=""true"" dir=""ltr"" href=""https://t.co/X7sNUGuxiG"">pic.twitter.com/X7sNUGuxiG</a></p>"
CNN,CNN,1022707914224676869,2018-07-27 04:59:02,/CNN/status/1022707914224676869,204,18,40,American Airlines is ending its carry-on ban for Basic Economy customers https://cnn.it/2LC4ooT pic.twitter.com/IvH54Foyb8,"<p class=""TweetTextSize js-tweet-text tweet-text"" data-aria-label-part=""0"" lang=""en"">American Airlines is ending its carry-on ban for Basic <strong>Economy</strong> customers <a class=""twitter-timeline-link"" data-expanded-url=""https://cnn.it/2LC4ooT"" dir=""ltr"" href=""https://t.co/sr9yxXCdZa"" rel=""nofollow noopener"" target=""_blank"" title=""https://cnn.it/2LC4ooT""><span class=""tco-ellipsis""></span><span class=""invisible"">https://</span><span class=""js-display-url"">cnn.it/2LC4ooT</span><span class=""invisible""></span><span class=""tco-ellipsis""><span class=""invisible""> </span></span></a><a class=""twitter-timeline-link u-hidden"" data-pre-embedded=""true"" dir=""ltr"" href=""https://t.co/IvH54Foyb8"">pic.twitter.com/IvH54Foyb8</a></p>"
CNN,CNN,1022572333842751498,2018-07-26 20:00:17,/CNN/status/1022572333842751498,192,21,35,American Airlines is ending its carry-on ban for Basic Economy customers https://cnn.it/2AdbImt pic.twitter.com/GNiuGmALxF,"<p class=""TweetTextSize js-tweet-text tweet-text"" data-aria-label-part=""0"" lang=""en"">American Airlines is ending its carry-on ban for Basic <strong>Economy</strong> customers <a class=""twitter-timeline-link"" data-expanded-url=""https://cnn.it/2AdbImt"" dir=""ltr"" href=""https://t.co/q7Vsyk3PqG"" rel=""nofollow noopener"" target=""_blank"" title=""https://cnn.it/2AdbImt""><span class=""tco-ellipsis""></span><span class=""invisible"">https://</span><span class=""js-display-url"">cnn.it/2AdbImt</span><span class=""invisible""></span><span class=""tco-ellipsis""><span class=""invisible""> </span></span></a><a class=""twitter-timeline-link u-hidden"" data-pre-embedded=""true"" dir=""ltr"" href=""https://t.co/GNiuGmALxF"">pic.twitter.com/GNiuGmALxF</a></p>"
CNN,CNN,1022427449257328640,2018-07-26 10:24:34,/CNN/status/1022427449257328640,83,25,36,Investors are embracing the booming economy -- but they're preparing for a downturn https://cnn.it/2NOft3F ,"<p class=""TweetTextSize js-tweet-text tweet-text"" data-aria-label-part=""0"" lang=""en"">Investors are embracing the booming <strong>economy</strong> -- but they're preparing for a downturn <a class=""twitter-timeline-link u-hidden"" data-expanded-url=""https://cnn.it/2NOft3F"" dir=""ltr"" href=""https://t.co/jjSQMxnTLx"" rel=""nofollow noopener"" target=""_blank"" title=""https://cnn.it/2NOft3F""><span class=""tco-ellipsis""></span><span class=""invisible"">https://</span><span class=""js-display-url"">cnn.it/2NOft3F</span><span class=""invisible""></span><span class=""tco-ellipsis""><span class=""invisible""> </span></span></a></p>"
CNN,CNN,1022402821583458304,2018-07-26 08:46:42,/CNN/status/1022402821583458304,89,34,38,Investors are embracing the booming economy -- but they're preparing for a downturn https://cnn.it/2AcUbKX ,"<p class=""TweetTextSize js-tweet-text tweet-text"" data-aria-label-part=""0"" lang=""en"">Investors are embracing the booming <strong>economy</strong> -- but they're preparing for a downturn <a class=""twitter-timeline-link"" data-expanded-url=""https://cnn.it/2AcUbKX"" dir=""ltr"" href=""https://t.co/AIfdK6aY1p"" rel=""nofollow noopener"" target=""_blank"" title=""https://cnn.it/2AcUbKX""><span class=""tco-ellipsis""></span><span class=""invisible"">https://</span><span class=""js-display-url"">cnn.it/2AcUbKX</span><span class=""invisible""></span><span class=""tco-ellipsis""><span class=""invisible""> </span></span></a></p>"
CNN,CNN,1022320877386559490,2018-07-26 03:21:05,/CNN/status/1022320877386559490,91,24,25,"How the US economy is doing now, in four charts https://cnn.it/2Adi5Gk pic.twitter.com/TtVQEG6KIZ","<p class=""TweetTextSize js-tweet-text tweet-text"" data-aria-label-part=""0"" lang=""en"">How the US <strong>economy</strong> is doing now, in four charts <a class=""twitter-timeline-link"" data-expanded-url=""https://cnn.it/2Adi5Gk"" dir=""ltr"" href=""https://t.co/Yg87JaMKv9"" rel=""nofollow noopener"" target=""_blank"" title=""https://cnn.it/2Adi5Gk""><span class=""tco-ellipsis""></span><span class=""invisible"">https://</span><span class=""js-display-url"">cnn.it/2Adi5Gk</span><span class=""invisible""></span><span class=""tco-ellipsis""><span class=""invisible""> </span></span></a><a class=""twitter-timeline-link u-hidden"" data-pre-embedded=""true"" dir=""ltr"" href=""https://t.co/TtVQEG6KIZ"">pic.twitter.com/TtVQEG6KIZ</a></p>"
CNN,CNN,1022213466806018048,2018-07-25 20:14:16,/CNN/status/1022213466806018048,63,29,42,"How the US economy is doing now, in four charts https://cnn.it/2Oi6QPV pic.twitter.com/od39ODc3bW","<p class=""TweetTextSize js-tweet-text tweet-text"" data-aria-label-part=""0"" lang=""en"">How the US <strong>economy</strong> is doing now, in four charts <a class=""twitter-timeline-link"" data-expanded-url=""https://cnn.it/2Oi6QPV"" dir=""ltr"" href=""https://t.co/Xg1wuYOfRI"" rel=""nofollow noopener"" target=""_blank"" title=""https://cnn.it/2Oi6QPV""><span class=""tco-ellipsis""></span><span class=""invisible"">https://</span><span class=""js-display-url"">cnn.it/2Oi6QPV</span><span class=""invisible""></span><span class=""tco-ellipsis""><span class=""invisible""> </span></span></a><a class=""twitter-timeline-link u-hidden"" data-pre-embedded=""true"" dir=""ltr"" href=""https://t.co/od39ODc3bW"">pic.twitter.com/od39ODc3bW</a></p>"
