tweet-id,user,fullname,text,timestamp,day_timestamp,sentiment,day_average_sentiment,likes,replies,retweets
1043259386850885633,CNN,CNN,"Low unemployment combined with a strong economy means the US Army is unlikely to meet its recruitment goal for the 2018 fiscal year, according to army officials https://cnn.it/2zmtjWp pic.twitter.com/CCmhIr6Gr6",2018-09-21 22:03:15,2018-09-21,-0.1779,-0.1779,130,47,64
1044791436154163203,CNN,CNN,"Where American or European companies could once expect to find an enormous market hungry for their products, changing tastes and the challenge from new Chinese rivals are forcing them to adopt new strategies to succeed in the world's second biggest economy https://cnn.it/2OfeqNV pic.twitter.com/a46ELu4TEH",2018-09-26 03:31:04,2018-09-26,0.6369,0.7285333333333334,108,14,39
1044866870443200514,CNN,CNN,"Where American or European companies could once expect to find an enormous market hungry for their products, changing tastes and the challenge from new Chinese rivals are forcing them to adopt new strategies to succeed in the world's second biggest economy https://cnn.it/2DxEcJa pic.twitter.com/UKOGc6B4fR",2018-09-26 08:30:49,2018-09-26,0.6369,0.7285333333333334,105,11,31
1045054796271689729,CNN,CNN,"The Federal Reserve raised interest rates for the third time this year, upping the rate that helps determine costs of mortgages and credit cards. The decision, which was expected, is a sign of increased confidence in the US economy. https://cnn.it/2DxmKV9 pic.twitter.com/CEUIpfBlCV",2018-09-26 20:57:34,2018-09-26,0.9118,0.7285333333333334,109,32,71
1045156349888397313,CNN,CNN,"76% percent of registered voters say that Supreme Court appointments are ""very important"" to their vote in 2018, a new Pew Research Center poll finds. This marks the first time since August 2004 that the economy has not been the top ""very important"" issue. https://cnn.it/2OfHqF9 pic.twitter.com/1sBjGDfp0N",2018-09-27 03:41:06,2018-09-27,0.7347,0.82325,393,101,134
1045274354601340928,CNN,CNN,"The Federal Reserve raised interest rates for the third time this year, upping the rate that helps determine costs of mortgages and credit cards. The decision, which was expected, is a sign of increased confidence in the US economy. https://cnn.it/2DxmKV9 pic.twitter.com/glkPlw2Gqv",2018-09-27 11:30:01,2018-09-27,0.9118,0.82325,96,28,50
1045920122685272064,CNN,CNN,"76% percent of registered voters say that Supreme Court appointments are ""very important"" to their vote in 2018, a new Pew Research Center poll finds. This marks the first time since August 2004 that the economy has not been the top ""very important"" issue. https://cnn.it/2NMCFDM pic.twitter.com/51wrRQv2jT",2018-09-29 06:16:04,2018-09-29,0.7347,0.7347,1375,120,314
1047889363575685126,CNN,CNN,It's Amazon's world. We just live in it. @CNNBusiness takes a closer look at the company with the ability to shape the American economy in its own image https://cnn.it/2O64Xcv pic.twitter.com/aKNh3jWjBB,2018-10-04 16:41:07,2018-10-04,0.3182,0.3182,103,17,31
1049060583709052930,CNN,CNN,"The economy is doing great. But GM, GE and General Mills are getting left behind. https://cnn.it/2PkeuJE pic.twitter.com/3EInUvaQpS",2018-10-07 22:15:08,2018-10-07,0.3716,0.3716,129,56,59
1049185594084081664,CNN,CNN,China is pouring more cash into its flagging economy as it braces for further pain from the trade war with the United States https://cnn.it/2Pq5mmU ,2018-10-08 06:31:53,2018-10-08,-0.6597,-0.22869999999999996,162,32,96
1049289177605595138,CNN,CNN,"Today's top business headlines with @ChristineRomans before the opening bell:

- China pumps more cash into its economy

- Bond yields at multi-year highs

- Lacroix sued for allegedly using cockroach insecticide

- October’s record box office

https://cnn.it/2y6VlnX pic.twitter.com/2BtbEybCto",2018-10-08 13:23:29,2018-10-08,0.2023,-0.22869999999999996,70,19,27
1051508901865242625,CNN,CNN,"Any US sanctions over missing journalist Jamal Khashoggi would ""stab its own economy to death,"" says Turki Aldakhil, general manager of the Saudi-owned Al-Arabiya news channel https://cnn.it/2yHgoN8 pic.twitter.com/nT3JbXJrCr",2018-10-14 16:23:52,2018-10-14,-0.7184,-0.7184,288,156,154
1054176287789539328,CNN,CNN,"Republican Ron DeSantis' closing statement: ""I'm the guy who can lead Florida and protect our future. We have got to keep our economy going... We can't destroy it with stiff tax increases...""

#FLGovDebate https://cnn.it/2EwHWem pic.twitter.com/7WbftaBWAg",2018-10-22 01:03:07,2018-10-22,0.6652,0.6652,1760,438,604
